ID,Start time,Completion time,Email,Name,I can use pipe,I know what wc is,I can use wc,I can use cut,I can use grep,I can use regular expressions,I can use sed,I can write a bash script,I can use redirection,I can make a symbolic link,I can use environment variables,I can use gzip,I can use tar,"Overall, how would you rate this training event?","What do you think about the pace of teaching overall today? 

","Would you recommend this course to your colleagues?
","Which future training topics would you like to be provided by the training host(s)?
","Do you have any additional comments?

Suggestions/ideas:

- What did you like best? (materials, exercises, structure)
- Where should we improve? (materials, exercises, structure)
- Training organi...",Last modified time
1,6/3/26 15:18:40,6/3/26 15:21:11,anonymous,,I can absolutely do this!,I can absolutely do this!,I can absolutely do this!,I can absolutely do this!,I can absolutely do this!,I can absolutely do this!,I can absolutely do this!,I can absolutely do this!,I have some confidence I can do this,I have some confidence I can do this,I have some confidence I can do this,I have good confidence I can do this,I have good confidence I can do this,8,Richael is a very nice teacher,Yes,"I would like future training on Bash scripting for HPC workflows, job submission scripts, environment modules, data processing with grep/sed/awk, and practical examples for scientific computing.","I really appreciated the hands-on structure of the course. The exercises were useful and helped me understand Linux commands by practicing them directly in the terminal. The explanations were clear, and the pace was generally good.  As a suggestion, it would be helpful to include a short summary table of the most important commands at the end of each session, with examples and common mistakes. This would be especially useful for beginners or participants who are new to HPC environments.  Overall, I found the course very helpful and well organised. Thank you for the training.",
2,6/3/26 15:54:36,6/3/26 15:56:39,anonymous,,I can absolutely do this!,I can absolutely do this!,I can absolutely do this!,I have good confidence I can do this,I can absolutely do this!,I have good confidence I can do this,I have good confidence I can do this,I have good confidence I can do this,I have good confidence I can do this,I have some confidence I can do this,I have good confidence I can do this,I have good confidence I can do this,I have good confidence I can do this,9,Great,Yes,More bash scripting,All was just fine thank you,
3,6/3/26 15:55:34,6/3/26 15:56:50,anonymous,,I have some confidence I can do this,I have good confidence I can do this,I have good confidence I can do this,I have some confidence I can do this,I have good confidence I can do this,I have low confidence I can do this,I have some confidence I can do this,I have good confidence I can do this,I have some confidence I can do this,I have some confidence I can do this,I have good confidence I can do this,I have some confidence I can do this,I have some confidence I can do this,7,"It was a bit fast. I think it would benefit from going thorugh the exercises together briefly after we have done them each, to discuss any questions/issues in the group. ",Yes,,,
4,6/3/26 15:55:03,6/3/26 15:57:11,anonymous,,I have good confidence I can do this,I have good confidence I can do this,I have good confidence I can do this,I have good confidence I can do this,I have good confidence I can do this,I have good confidence I can do this,I have good confidence I can do this,I have good confidence I can do this,I have low confidence I can do this,I have low confidence I can do this,I have good confidence I can do this,I have some confidence I can do this,I have good confidence I can do this,8,First it was i a bit fast but then it was better-,Yes,,,
5,6/3/26 15:54:43,6/3/26 15:57:23,anonymous,,I have good confidence I can do this,I have good confidence I can do this,I have good confidence I can do this,I have good confidence I can do this,I have good confidence I can do this,I have some confidence I can do this,I have some confidence I can do this,I have some confidence I can do this,I have some confidence I can do this,I have some confidence I can do this,I have some confidence I can do this,I have good confidence I can do this,I have good confidence I can do this,8,Overall good but as a first timer I need to go away and consolidate,Yes,,,
6,6/3/26 15:54:37,6/3/26 15:59:35,anonymous,,I have some confidence I can do this,I have some confidence I can do this,I have some confidence I can do this,I have some confidence I can do this,I have good confidence I can do this,I have good confidence I can do this,I have good confidence I can do this,I can absolutely do this!,I have some confidence I can do this,I have good confidence I can do this,I have some confidence I can do this,I have good confidence I can do this,I have good confidence I can do this,10,"overall was good but in my opinion Birgitte goes a bit fast on the topics, especially on definitions ",Yes,,,
7,6/8/26 11:05:53,6/8/26 11:12:11,anonymous,,I can absolutely do this!,I can absolutely do this!,I can absolutely do this!,I can absolutely do this!,I can absolutely do this!,I can absolutely do this!,I can absolutely do this!,I can absolutely do this!,I can absolutely do this!,I can absolutely do this!,I can absolutely do this!,I can absolutely do this!,I can absolutely do this!,9,Good,Yes,"AI, Data Analytics, ML, Docker etc.",,
